title;abstract;
Pediatric asthma and air pollution;This study explores the impact of urban air pollution on asthma severity in children. Data from 12 cities were analyzed.;pediatrics
Genetic markers in breast cancer;We identified novel genetic mutations associated with breast cancer progression using whole-genome sequencing.;oncology
Stroke recovery and neuroplasticity;A longitudinal study on stroke patients reveals how neuroplasticity supports motor function recovery.;neurology
Thyroid dysfunction in pregnancy;This paper reviews the effects of hypothyroidism and hyperthyroidism on maternal and fetal outcomes.;endocrinology
COVID-19 vaccine response in elderly;Immune response to mRNA vaccines was assessed in individuals over 70, showing reduced antibody titers.;infectious diseases